cluster,n_rows,weighted_n,pct_of_population,pct_high_income,lift_vs_base_high_income,mean_age,mean_weeks_worked,mean_wage_per_hour,mean_dividends,top_differentiators
0,375,668423.87,0.0019249295225507897,0.881491186124158,13.762457550802923,46.23965038830824,47.87409393383872,27.66902841156765,1786.1810279157144,"high capital gains (mean 99999.0) | high weeks worked in year (mean 47.9) | high dividends from stocks (mean 1786.2) | education 'Prof school degree (MD DDS DVM LLB JD)' (25%, 27.5× base) | class of worker 'Self-employed-incorporated' (21%, 12.8× base) | major industry code 'Medical except hospital' (14%, 6.0× base)"
2,315,548000.7999999999,0.0015781347220610938,0.707090354612621,11.039589667057351,58.726213720855895,24.84052026931348,42.49420422378946,37327.85263672973,"high dividends from stocks (mean 37327.9) | high capital gains (mean 7656.0) | high age (mean 58.7) | major industry code 'Armed Forces' (0%, 9.8× base) | major occupation code 'Armed Forces' (0%, 9.8× base) | education 'Doctorate degree(PhD EdD)' (4%, 6.2× base)"
1,3779,6831179.76,0.019672456631262162,0.3042985901457232,4.75092263606573,43.5455821865241,41.79097327692047,80.07167441162461,441.7566946737762,"high capital losses (mean 1934.3) | high weeks worked in year (mean 41.8) | high num persons worked for employer (mean 3.5) | education 'Prof school degree (MD DDS DVM LLB JD)' (4%, 4.3× base) | major industry code 'Mining' (1%, 3.6× base) | class of worker 'Self-employed-incorporated' (5%, 3.1× base)"
3,91309,162050200.0,0.46667276277141323,0.11177886488261045,1.7451698976002976,38.44572162842132,47.20257117627747,115.9516968089518,133.690679949238,"high weeks worked in year (mean 47.2) | high num persons worked for employer (mean 4.0) | high wage per hour (mean 116.0) | major industry code 'Communications' (1%, 2.0× base) | class of worker 'Local government' (8%, 2.0× base) | major occupation code 'Technicians and related support' (3%, 2.0× base)"
5,36883,63294686.49,0.18227627126062632,0.016315158463785923,0.2547236765687307,64.32031470340252,1.408852205849673,2.2991606480741726,340.29415478901126,"high age (mean 64.3) | low weeks worked in year (mean 1.4) | low num persons worked for employer (mean 0.2) | tax filer stat 'Joint both 65+' (19%, 4.6× base) | marital stat 'Widowed' (22%, 4.4× base) | full or part time employment stat 'Not in labor force' (47%, 3.4× base)"
4,66862,113853401.55,0.32787544509208627,0.00034589041226586,0.005400283282433334,11.497377286484772,1.0492685403653625,3.4765497387109026,6.297283954710267,"low age (mean 11.5) | low weeks worked in year (mean 1.0) | low num persons worked for employer (mean 0.2) | education 'Children' (69%, 3.0× base) | detailed household summary in household 'Child under 18 never married' (72%, 3.0× base) | class of worker 'Never worked' (1%, 2.8× base)"
